Reviewer name,Review,Rating,Package name
lwin koko,I encounter with endless file upload completing at 100% and never turn completed. also encounter with invalid key decryption error during download my assignments and nearly kick off from my school! Is there way fix these error?,2,mega.privacy.android.app
James Brady,"Doesn't let me choose where to download my files anymore, which just makes sorting files more frustrating, and the app way less useful.",2,mega.privacy.android.app
Nitika Kumari,App was working just fine i just logged out and then again tried to log in but now it shows that my email doesn't exist. Idk if it's some kind of bug or something else hope they sort it soon :(,2,mega.privacy.android.app
Akshay Vispute,"1. Very slow app 2. it crashes on Samsung M51 all the times. 3. Interface is worst and not very handy 4. Data heavy app, eats a lot of data",2,mega.privacy.android.app
Aditya Punwatkar,"It takes so much time to load the data, and crashes hell lot of time please improve the version.",2,mega.privacy.android.app
Lee Volka,"For some reason when files are being downloaded it takes a significantly longer than normal time to download and makes other internet using actions near impossible, like I can't even search on google level. Sometimes leving the app will also cause all download progress to be lost and I have to start over too. Don't know if this is an issue with my settings or just my device but make thing hard to do when I use the software for work.",2,mega.privacy.android.app
Nicolas Sanchez,"I can't login from the app, when I try to login there's a message saying ""Invalid email address"", but if try to login from the website I can login without any problems so I assume that's a problem from the app maybe. What can I do to solve this?",2,mega.privacy.android.app
DatswhatiDrew,I've had Mega for awhile. Until recently they messaged me saying my files may be deleted if I did not upgrade. I've had them on there for a few years and I cannot access them. I've chosen to upgrade but will not be continuing. I give them two stars just because I was able to save my files during this time.,2,mega.privacy.android.app
Rimurey,"i like the app and what it can do what i really dislike is recently my space filled up and for some reason when your space is full it doesn't let you delete things. i kept trying to delete files and things and everytime i tried it just popped up its offer to increase storage, eventually the app just cleared absolutely all of my files instead of enough files to bring the space back down, im pretty annoyed about that. ive lost some important files bc of this that i couldn't back up along some pics",2,mega.privacy.android.app
Boniface Wainaina,"Have been using mega for many years, but of late its not working on Android Chrome. At first whenever I would send email to client with mega link to some files, the emails would bounce back as it would be flaged as spam. Now when I try to open mega.nz on android chrome I get an error; ""You cannot visit mega.nz right now because the website uses HSTS. Network errors and attacks are usually temporary, so this page will probably work later."" Please rectify one need to access the files on the go...",2,mega.privacy.android.app
Lexx,"I love this app! but ever since they removed the option to select where you wanted the file to go it just made it worse, if they added it back it'd be 5 stars",2,mega.privacy.android.app
Ndangoh Formusoh,I'd like the options to disable autoplay for videos and use the fingerprint scanner to gain access. You can only upload one file from the gallery at a time and some videos buffer a lot and just aren't playable and the option to send feedback is broken; tapping it will open a sharing menu.,2,mega.privacy.android.app
Chriszy Boisz,"After the latest update, the option to upload multiple folders were removed. This is a huge problem since you would have to upload everything multiple times which is incredibly annoying and a downgrade from before. And not mentioning this in the update log then doing so without telling us is incredibly frustrating and disheartening. I recommend everyone else to not update their app.",2,mega.privacy.android.app
owenz291,This is a mess this is hot garbage its so glitchy the app crashes randomly every 5 minutes and you cant download anything without it crashing this app is horrible and a waste of time,2,mega.privacy.android.app
Talha Qamar,"""Unable to find my two folders"""" Hi, I've been trying to find my two folders named (skool & SS) in my cloud account  kindly guide me on how can i get those folders back. I've been using from 2017. Will be really thankful to you guys for this. Your loyal user☺",2,mega.privacy.android.app
Ryan Wyse,"Takes forever to transfer files to where they actually show up, and it doesn't integrate with anything.",2,mega.privacy.android.app
Masud Rana,This app never works properly....it's crashing all the time whenever I wanted to download something. Always lagging to watch any saved videos,2,mega.privacy.android.app
afaque azam,It used to be the best cloud storage app. But for the past few days the app is getting crashed everytime I use. Really disappointed.,2,mega.privacy.android.app
A Google user,"Somehow not sure how i keep losing this account. Just made another one and i know for fact, im reporting this issue to ya now, someone already has been in there an ive. Never had let anyone in my account. They are good. Like this time are saying hello. Always messing with my settings, turning off my 4 didgit passcode, turning off my fingerprint code. Like they have a magic key let themselves in, i found a picture of my whole family of us took on a holiday together i didn't have in there.im scar",2,mega.privacy.android.app
Ahsanuzzaman Rumi,"I have forget my mega password. For retrive my password, password recovery function is not comming in my mega android app, Give me an mega latest update as soon as possible, otherwise I can't retrive my mega password.",2,mega.privacy.android.app
Kaydencrosee,For a good 2 days it worked fine but now it won't play the clips or download the videos to my camera roll saying I need to upgrade or whatever when I've only been using it for 3 days,2,mega.privacy.android.app
Abhishek Nautiyal,"app issue initially a option of three dots use to come in cloud drive, now only search option is coming in mobile app. No way to open link in app and download, if any suggestion by developer please do give your advice.",2,mega.privacy.android.app
A M,"Really good app, but now it's forcing me to upgrade. When I go to delete data from the app to make space it won't let me and comes up reminding me I have set amount of time until I loose data if I don't upgrade, then comes up with an error it can't move, I'm trying to move to the recycling bin to delete, all I want to do is delete it to makes space so I don't have to upgrade but it won't let me. If this is not fixed I will be forced to go to a rival and promote there product instead",2,mega.privacy.android.app
Yegor Biziuk,The document scanner is a joke. It just takes a picture it doesn't transform it to a document like for example Dropbox does. Also the desktop app doesn't syncronise all the files. I don't like this cloud service. It's generous with the amount of data but it's poorly made,2,mega.privacy.android.app
Shankha Chakrabortty,"Doesn't even open without creating or login account... So, please create a homepage interface that is accessible without login or creating new account... Add a navigation address bar to open shared folder. Downloading Service is really better than gdrive, 5* for that... Update 31.12.2021: Pause-Resume Support Completely Vanished after you Accidentally Close or Exit the App. Automatically Delete the Cached Data immediately after Exiting App unlike Previous Version.",2,mega.privacy.android.app
Cara Lea,The interface is ready to use with one GLARING exception. NO MATTER WHERE IN THE PAGE I SCROLL IT SENDS ME HUNDREDS OF PAGES AWAY. I'm trying to move down a page and it'll pull up the sidebar scroller on the OPPOSITE end of the screen and act as if I've decided to go from page 567 to 234. It's horribly obnoxious and it happens literally every time. MEGA you MUST fix this.,2,mega.privacy.android.app
Frankie Frausto,"I understand that I'm at my capacity of maximum storage and I was notified plenty of times beforehand that I should've done something about it, but to just let me enter and look at my files and not be able to delete or save (the excess files) to my device just so y'all can do it (delete all of my files) yourselves and FORCING me to pay for a service I can't afford (I'm / my services are living off of gift cards), is just messed up.",2,mega.privacy.android.app
Antor,"1. After start download and screen off, than after some time app close and download stop. 2. After download, I cant remove mega download notificaton.",2,mega.privacy.android.app
Beyond Limits,"Been using this for almost one year but it says ""transfer quota exceeded"" . Now I am going to move my files to GDrive.",2,mega.privacy.android.app
Mark,"Insists on downloading larger files only through the app, even when I prefer (mostly) to use the online website. The only storage website I'm aware of to do this, and its annoying. Not everyone wants to use the apps.",2,mega.privacy.android.app
Miss belinsky,"The new update ruined everything, it just shows black open when I launch the app, I try reinstalling but it doesn't work",2,mega.privacy.android.app
Punit Joshi,"Only problem with app is, the video takes hell lot of time to load. It takes me around 3-4 mins to load a 20 minute video! Maybe if they could fix this, it would be a really good app",2,mega.privacy.android.app
Lahiru Manawadu,"Hey developers, why do you guys make the app harder to use in every update??... after latest update i can't select and upload multiple/all items at once...",2,mega.privacy.android.app
Nick Willard,This has got to be the most unstable app I've ever used. Fantastic service but the app is just terrible.,2,mega.privacy.android.app
Adnan Siddiqui,"Free Version Storage Gets Slashed When Few Months Are Passed , I Got 50GB Of Free Storage & Later When I Saw , It Came Down To 20GB Only ! Fun Fact : One Profile Has 29Gb Of Upload Already & Maximum Storage Limit Is 20GB 😂 I Doubt Mega Cloud Big Time.",2,mega.privacy.android.app
blinktud,"Can we get more video playback options? Like playback speed, more volume, etc? And just general bug fixes? It tends to crash a lot.",2,mega.privacy.android.app
Emica Haga,"I thought that this app is going to help me a lot since the reviews are pretty high but I only get to use this app for an hour. First issue ; After uploading a few files, the app started crashing and i can't open it since it kept going back to my home screen so i thought that if i reboot my device, maybe it'll start working again and it worked! Second issue ; When i tried making my uploaded videos offline, It doesn't do anything. I thought that rebooting my device is gonna work but NO.☹️",2,mega.privacy.android.app
N P,Recent update I can't even save files from the app.,2,mega.privacy.android.app
Zfk Zfk,Doesn't have auto sync option. Can start current build on Mi 11i.,2,mega.privacy.android.app
Pinak Bheed,"I have been using mega account for the past 3 years. However, i recently installed the android app. the sync feature to upload photos and videos from the camera folder is completely broken. i searched online for solutions and only found that this has been broken for more than a year now. Additionally, there are a lot of missing features that would be nice to have regarding sync. A finer control over what folders to sync (just like the desktop) app is missing and is very much needed.",2,mega.privacy.android.app
Byron Voogt,"The download manager leaves much to be desired. Resuming is non-existant, theres no speed indicator and one downloads are complete they disappear from your history so if you've forgotten what you've downloaded and want to resume on a certain file you have to manually check your gallery. Big thumbs down for the fact that even with the ""use mobile data"" option disabled, the app downloaded on my mobile data the minute I lost wifi signal. Streamline your mobile site so it works efficiently with Samsung internet or UC Browser and get rid of this app.",2,mega.privacy.android.app
Ryan F,"Too many flaws. I can't save any files to my smartphone, I already gave permission to write, edit, etc. on my SD card and yet it always shows ""write error"" everytime I try to download something. Other solution is to make it offline first, but then I still can't save it to my device. The only way out is to copy the file as is or make it into .zip/.rar/etc. through the share option using a 3rd party file manager. Edit : Thanks for the response. I'll wait for the update for sure.",2,mega.privacy.android.app
Lucy S,"I tried moving to MEGA from Dropbox but I've since switched back to Dropbox for file syncing. The app is okay, but I dislike that you can't share images/GIFs etc directly into other apps (i.e. rather than sharing the download link). You also can't preview documents without downloading them. Also MS Word, which I use a lot, doesn't have any integration for MEGA so you can't import files directly from the Word app. I'd only recommend MEGA if you're serious about end-to-end encryption.",2,mega.privacy.android.app
Alex Mcgregor -harper,"Original was great, now not so sure. Every time I try to go on to mega to access my files it claims it can't reach the servers and that my connection must be bad despite my WiFi connection being perfect and I'm the only one using it. I've cleared cache, restarted my device and uninstalled then reinstalled but that hasn't helped. Other than that the app itself could do with the ability to move files into your own order and add cover pictures to files to better identify them.",2,mega.privacy.android.app
Ibrahim Khalil,It takes huge time to view a video in chats...it buffers a lot ....even though i viewed it many times ....it needs to reload the video every single freaking time..,2,mega.privacy.android.app
Wandile Zondo,it's good. convenient feature but I've once referred 2 people but I still have received my 2 free 5GB's,2,mega.privacy.android.app
Peter Harrell,"REALLY NEED A RESPONSE TO THIS PLEASE! Been using mega for years and it's always been brilliant. Recommended to many friends and they also now use mega. Never had a complaint. However, for the past few weeks, when you try to open a word file using the Android app, it just says ''already downloaded'. My wife is having the same problem with PDF's. The file should just open for viewing straight away. Something to do with the last update? please get this fixed as it's making the app unusable! thx",2,mega.privacy.android.app
Tool Kit,"The app is good. But the problem is they provide free storage, and then deduct the free storage or their free storage expires; which causes files to be in access of whats alloted. this is very frustrating. I cannot add any more files, have to delete the excess files, or constantly convince people to join Mega. Frustrating experience.",2,mega.privacy.android.app
Priyanshi Pandya,"Its good cloud service, but lately everything seems to get into ""retrying"" whenever i download any file!",2,mega.privacy.android.app
Snowflake Music,"I backed up 1000+ files. After restarting the app, only 140 appeared. 😑",2,mega.privacy.android.app
Sathwik Yalagala,"App is good but there is one problem with recent update When I set a fingerprint lock and lock time as 5 seconds it is not getting locked , when I tap on any side on the screen it is directly taking to home screen of mega without any pincode or finger print password",2,mega.privacy.android.app
Shafi Smaili,"Gallery view is welcome, but broken. Back gesture kicks you out of the app.",2,mega.privacy.android.app
alan xalil,The video player is very bad and it keeps stopping!!,2,mega.privacy.android.app
Michael Morris,My experience it couldn't upload what I wanted to upload. This was a good app once .,2,mega.privacy.android.app
Prixie Chan,Starts auto uploading all my files and I couldn't stop it from uploading 🙄🙄,2,mega.privacy.android.app
Muhammad Fatihuddin,after download complete file not showing on file explorer on android 11,2,mega.privacy.android.app
K P,"Uploading multiple large files causes app large cache size, doesn't make sense cuz it's wasn't this way before when I upload through browsing via another app for choosing files to upload and doesn't have to load up whenever uploading a larger file/media. It'll just multiply the size of the file resulting in large caches and causes unnecessary storage space consumption! Fix this y'all!",2,mega.privacy.android.app
Zhr Id,"Not sure if it's just me but this doesn't play videos although WiFi is strong also got plenty of free phone space. Why are videos not playing?it takes so much time to load. the video file is just 10 seconds long!Update: some videos are working suddenly but still not all. most of playing videos have just sound and dark screen! Downloading of videos takes too long,not possible :( Please make it possible for us to zoom in when playing videos for cellphone if not done yet (on laptop not possible)",2,mega.privacy.android.app
Maxim Shevchenko,"It's said 50 GB for free, actually it's 15 GB plus 35 GB as a temporary bonus. When saving offline files, isn't it just downloading them? It should be accessible only from MEGA for security. After updating offline files and connecting to Wi-Fi, they don't update in MEGA! So, I have to replace old files on new ones manually. Closing app causes stop downloading and uploading, so I've to download it from the beginning. And after the last upds I cannot to listen to media in the background anymore.",2,mega.privacy.android.app
Ryan Evans,it's ok but i just wish the files/folders had thumbnails on them instead of just looking so plain 😒 if they put thumbnails on files/folders in their next update i might rate MEGA 5 stars,2,mega.privacy.android.app
Raquel Prado,"it doesn't work well on my phone, it's always hard to upload a photo on Cloud it really drives me crazy, I'm only using this app bc i don't like Google Drive but I'm almost done with it 🙄",2,mega.privacy.android.app
DETECTIVE IH,While streaming any videos the player layout has a bug of covering 1/3rd of the videos. After several updates yet no fix to it.,2,mega.privacy.android.app
Awo Mohamed,The page log in is too much I have been trying it for 2 weeks and still it doesn't let me in its just a waste of time and I really dislike it I was hoping it would be easier way to get in but when I made the account and still it's saying email verified,2,mega.privacy.android.app
Dhruv kumar Yadav,"Downloading speed is very low please improve your server, it takes so much time to download a particular file, while I am having a 100mbps wifi connection it's very disappointing.😔😔😞",2,mega.privacy.android.app
BloodBought Son,This app sucks. It automatically grabbed all my stuff. If if there is something you need to pull down good luck. It just sits there tapping it will do nothing.,2,mega.privacy.android.app
Kiran Kumar,When i am start using this app they give me 50GB free cloud storage. But now they turn into commercial thinking way. 20GB is free storage now. They are break my trust with latest updates..i hurted.they are forget there promise.,2,mega.privacy.android.app
Athanasios Mamarelis,"It seems like the app has been forgotten. Really old options. I cannot preview files, I cannot see what I downloaded, and really slow interface when it is compared to similar apps. If things stay like this, this is probably the last month I am paying for your service. Please do a decent update.",2,mega.privacy.android.app
Oliver Aniate,The app is good i can transfer my file securely but i can't reset or change my password on my first account i have some important file there and i can't access it. Why?,2,mega.privacy.android.app
Keydriel Catapang,"Nice, but the storage is very little. Although I can bear with that, I couldn't stand not being able to download directly from websites since they don't load! Even if I have the mega link, the app doesn't seem to allow to download via links anymore. Maybe I'm just being dumb and I forgot where that button is? Either way, the app isn't as half-good as it is.",2,mega.privacy.android.app
K X,It was good until they changed the UI. I can't find the open link function or anything. Switched back to an older version as at least I know it'll work the way I need it to.,2,mega.privacy.android.app
vashti surya-harrell,I've been using the app for months and everything has been really good apart from the very odd glitch. However as of last week i now can't view any files on my phone. It says transferring and downloaded but it isn't. Real issue as the whole point of the app is so I can view things on my phone when I'm not at a computer! Any advice?,2,mega.privacy.android.app
Nishanth Varma,"The cloud storage and the prices are all good. But the app is worst. It sometimes stopes downloading. After multiple attemps of pausing and resuming the download, it starts downloading properly. Doesn't display notification of downloads sometimes. No option to report the bugs. App needs improvements.",2,mega.privacy.android.app
Thatour George Charis,"Not user friendly, expensive and too restrictive",2,mega.privacy.android.app
Jimit Soni,"I have more than 8000 files I need to upload but I can't upload them all at once, i need to do it one by one. How useful that is.",2,mega.privacy.android.app
Simon Raistrick,"I like how u can folder play audio files (only cloud service that does this!), but (a) the app just crashes on chromebook. (B) can't browse files in chromebook file system like all other cloud services (c) on phone android, Audio player turns off when I use other apps .. so plenty of room for improvement. (Windows app needs all files local as well, it can't do virtual file system like all other cloud services). Will probably cancel tbh.",2,mega.privacy.android.app
Abhinav Aggarwal,"App is very very large. Please reduce its size. Also, another problem is that large downloads cannot be downloaded through website, or using a download manager, we are forced to use the app for this. Also when I try to download a large file (about 1 GB size), the download is almost completed and then the app hangs and stops suddenly, so that the whole file is corrupted and it is rendered useless. This has happened several times with me. Please fix this.",2,mega.privacy.android.app
श्री सायि -लक्ष्मण,"No point anymore in having it, after they downscaled free storage to only 15 Gb. Also, there is serious problem with ""pause"" button. It doesn't work properly. If I pause uploading files, then restart phone, then return back to my Mega app, I find that all my paused (semi-uploaded) content is lost.. Huge waste of time! Shouldn't ""pause"" button allow us to continue upload at more convenient moment - even hours (if not days) later? Developers don't listen.",2,mega.privacy.android.app
Umario chan,"Bug where mega app is not being detected. Shared link opens on the browser mode of the app. Which is weird because it's using the app to open the lino but opens it on a browser format instead. And the file is too large for browser mode so yeah nah. Tried copying the link, error message pops up link is invalid. Paste link in browser voila link's good but too large for browser.",2,mega.privacy.android.app
Rushabh Bhalgat,I would have loved to give 5 star but it's current performance is very bad. It has lot of bugs but worst one is: if I try to redirect from a link and app is already running in background but still it restarts every time so the the data upload is never complete and so it's getting really annoying. Otherwise best app for download and file storage,2,mega.privacy.android.app
Justin Betts,"I used to be able to use the app with no issues at all. This last month has been so ridiculous. The app crashes evertime it gets to my drive. I download anything, it crashes. I upload anything, it crashes. Going from browser to app, it freezes my Samsung Galaxy S21 Ultra SM-G9980 512GB. I've cleared caches, deleted apps, and factory restored my device 3 times. It's become more of an issue to use, than to find another service.",3,mega.privacy.android.app
Nizar Nassar,"Been freezing up my phone lately. When I open the app the screen goes blank. Many of the files I try to upload fail and I don't notice at the time until later when I am missing my files. Matter fact, the app just crashed right now and a message prompt to close the app due to it not responding flashed on screen. What's the use of offering free storage if you can't store everything and can't even access the app? Was great at first but nose diving at the moment.",3,mega.privacy.android.app
Ian Smith,"Been using for a week, pretty solid experience. I wish the search functions in the app were more like Google drive. It's hard to narrow down and search for files using two words. Instead I have to search using one word and then look through all the results to find what I'm looking for. Kind of tedious, if fixed 5 stars.",3,mega.privacy.android.app
Mackenzie Daigle,"Why can we no longer select an entire folder?! So many people doubtlessly create subfolders for containing files that need to be further organized within a central folder! I pay for increased cloud storage each month and it's very infuriating when I have to locate, download, and install an older version of the MEGA app (version 4.3 ) in order to regain access to such a key feature. It was feature central to my decision to choose MEGA over Google, OneDrive, DropBox, etc..",3,mega.privacy.android.app
