Reviewer name,Review,Rating,Package name
Raphael Roxas,"It's a good app over all, but I wasn't able to know if my upload is done, through my notification. I am using this app for online storage, and I'm uploading 100 files, so I had to know whether they are finished or not yet, so I kept coming back and counting the total progress. I'd like to suggest putting in the progress in notification",3,com.mediafire.android
A Google user,"It doesn't give you the option to sign out from your account. There seems to be no way to cancel an uploading process for a file! Comparing to Onedrive app, I must say Mediafire's app sucks.",3,com.mediafire.android
Manzoor Baloch Official,Why there is no logout option and trash folder view or restore in MediaFire App? And I'm facing an other problem that I'm not getting password reset email with my Yahoo! Mail neither inbox nor spam folder. Please fix these problems in App within next update and fix that error on Website.,3,com.mediafire.android
Loves and Serves Jesus Christ,"When searching for a file, the search result/s are not sharable, nor show which folder/s they belong to. For me these are showstoppers.",3,com.mediafire.android
Blu Phoenix Rising Media LLC,App freezes if too many files. Doesn't always recognize duplicate copy. I have to have app open sometimes for files to start uploading.,3,com.mediafire.android
LEMO INC.,Please Increase your storage to 10 GB to 20 or 30gb I know you service are good then any other cloud services but MEGA is also providing 35gb free why not you ...?? I love love media fire 🔥 most then any other cloud services......🙏🙏🙏🙏 Thanks for listening I am not forcing you But Just a feedback If you able to solve all the above problems 🙂 i then will also increase my ratings to .... !!!!!,3,com.mediafire.android
Jr Ramirez,"App is great, only problem I had was uploading files. It says ""There was a problem uploading resource"", only way to upload at the moment is through internet app.",3,com.mediafire.android
Md YH Hridoy,The app works fine but when selecting app it need to select 1 by 1 which is annoying please fix that thing for user experience,3,com.mediafire.android
Dinath Senaratne,I don't even know if my files are uploading because it says uploading bit it is not in file transfer and it takes forever. But the storage is generous.,3,com.mediafire.android
Lisa Baltes,Very frustrated with this app. I was sent a file to media fire and it would download but not open. Customer service was no help at all.,3,com.mediafire.android
Alfred 2K Gaming,"When you upload something, you can't see the progress. You can only see if it's uploaded when you refresh the app and you see the file there.",3,com.mediafire.android
Progy,"When I upload a file, there's no notification bar showing the progress. This is required. PLEASE!",3,com.mediafire.android
Krushna Gattewar,Nice app but there is 1 issue. The files that are uploaded doesnt see in app. These files that are uploaded are in official website of mediafire. So please fix these and able us to see upload files in app.,3,com.mediafire.android
Cloud12TheReal,I was going to share a minecraft skin by sensing him a zip but it did not work. It keeps crashing and I dont understand why. Pls fix this i made my friend a cosmetic for him but it keeps crashing and I cant send it to him,3,com.mediafire.android
Phantom,The files that i have uploaded to mediafire and shared link shows that it is a dangerous file even it is not dangerous without any virus Sometimes when the upload is 30% complete it is damm stuck at 30% even if i have a greater uploading speed,3,com.mediafire.android
JT Leon,"Needs to update the ""search"". When a search is done and downloaded you then have to do the search again for another download. Need to be able to ""stream"" instead of downloading content.",3,com.mediafire.android
Elite Gamer Siddhu,"After using for 6 months when I upload any file, it will show error of there was a problem in uploading. Reinstalling the app again. If problem continues the 3 star review will drop to 1.",3,com.mediafire.android
Ericka Escalada,I'd like to give it five stars if only it will allow me to see the options button on each file so I can share or download my files. Sad.,3,com.mediafire.android
Dawood Tel,App always crash whenever i select any file to upload i have tried reinstalling but still same maybe its because of filesize (300mb) ?!,3,com.mediafire.android
R.S. Parlour,The website interface is better than app + app upload files very slowly comparing to website I downloaded this app because I think that the servers of website are down coz i am not able to upload file from website,3,com.mediafire.android
MAN JIT,"i like this app.backup my files.after some days when upload file not work.it says"" starting upload"" there is nothing file upload.what is the problem.?error occured.",3,com.mediafire.android
Freedom 71 Gamer,The problem is not in this app the problem is in my it's google website of yours. I'm tried to install a file but it shows download failed and it is also cannot download any other apps why.,3,com.mediafire.android
Matthew james Besona,App good when i installed the next time i used it well it was bugged can't even login to my account can't make another one as well pls fix this,3,com.mediafire.android
Mathew Jundoc,The problem to this is can't log-out so please add a log-out so that i can change my account.,3,com.mediafire.android
David Chan,My sister bought a business 2Tb pro plan. Sis passed away last year and when I went to close down her account I found tonnes of stuff. So I told Mediafire the situation and said I would take over her business account. They agreed after I showed the appropriate documents. They charged me correctly for the year. Then I get an email claiming her account has not been paid even though they've charged me already. They have zero customer service. And the ones they do have are all idiots.,3,com.mediafire.android
Darius Radar1,Its good but I changed my password and it says Unexpected login and I put the right password,3,com.mediafire.android
Dapbiang Snaitang,First this app was great but when I click share it didn't show the copy to clipboard button.So I cannot upload any of my files to chrome,3,com.mediafire.android
Mat Caun,SOMETIMES MEDIAFIRE LINKS HAVE BUGS THAT ARE SLOW TO DOWNLOAD ... EVEN THOUGH THE INTERNET IS VERY FAST ... BUT I NEED 1 HOUR TO DOWNLOAD A 1MB FILE .... I HOPE YOU CAN FIX IT,3,com.mediafire.android
Dj stoffels_aka_Ashton Dj stoffels,Would have give it 5stars but it's giving me problems. Does not want people ro download via mediafire link it give a Amazon link. Any way I can fix it.,3,com.mediafire.android
Dead Voxel,"I like Media Fire and all, but the app closes as soon as I open it, my tablet runs Android 9 if that helps",3,com.mediafire.android
Ramcharan Kewat,It's need little update like progress report for uploading files and if possible made play/pause support for upload and downloads.,3,com.mediafire.android
budoor alsalmi,I'm having a problem with my account and I can't upload any file on it. I truly don't know what's wrong with it but i need it ASAP so fix it.,3,com.mediafire.android
Polishing Talent UG,When you try to download yo file + signs appear every after and beginning of the word in the file name,3,com.mediafire.android
VENOM GAMING,😑😑 I was very excited to upload files but the app keeps stopping whenever i try to upload I am on Xiaomi Redmi 8A Dual On Android 10 *DISAPPOINTED*,3,com.mediafire.android
Thembinkosi Gomendo,"Fair. Too basic , features have to be added to make this app relevant. I'm still using it though.",3,com.mediafire.android
Apotheoz,I like the Mediafire platform but this app keeps crashing on MIUI 12 when I try to upload anything...,3,com.mediafire.android
Bhavishya Musaddi,Overall good app but you guys should give an option to cancel an upload also download download and upload speed is verrrrry slow,3,com.mediafire.android
COVERTY ANIMS -META ASSASIN-,Wth is wrong in the site right now. Whenever I wanna download something in mediafire it won't even let me go to the download link. Fix this.,3,com.mediafire.android
Mary Ann Balanga,"I've uploaded a file,but it says there was a problem at uploading the resources🙄🙄🙄🙄pls fix this",3,com.mediafire.android
sahil miglani,Everything is alright but storage space is very less and web upload is not working,3,com.mediafire.android
Ashwin Gudappu,Sorry for the 3-star rating the app is keep stopping that's why I am giving 3-star rating my files are not uploading,3,com.mediafire.android
DJ PIX L Games,Some times this apps lags as hell it fails to authenticate! FIX IT UP!,3,com.mediafire.android
Inder Mani Gaur,They should also make a PC version so we can synchronise between a mobile and PC,3,com.mediafire.android
Zolotaya Zima,why didn't you add the ability to add from external memory cards ?,3,com.mediafire.android
Albin Varghese,Please update the design. It would be better if the design would be like in the web,3,com.mediafire.android
BvN Character Station,Was really helpful till it crashed when uploading a file,3,com.mediafire.android
Mustafa Albakri,i had invited 2 friends and they were setting with me and registered for the mediafire account and they didn't give me the free space they promised to do otherwise everything is ok,3,com.mediafire.android
Angel Fluffy,Uploading via web is still fastet than the app,3,com.mediafire.android
ItzGamer851mc,Why taking so long to download :< I will change this review when it download and when its a good app.,3,com.mediafire.android
Kim seo Yi,Yesterday the app was working then today it says could not authenticated pls fix it,3,com.mediafire.android
Yazeed Abd Elmageed,Not practical.. Can't copy links immediately.. And my uploads disappear,3,com.mediafire.android
Radha Kumari,I WANT TO KNOW WHY MY FILES AREN'T GETTING UPLOADED A MONTH AGO IT WORKED GREAT BUT BY THE RECENT 10 DAY THE APP ISN'T LETTING ME UPLOAD BY SAYING THERE IS A PROBLEM IN RESOURCE WHILE WHEN I UPLOAD THE SAME THING ON THE WEBSITE IT GETS UPLOADED I HOPE THIS GETS REPAIRED,3,com.mediafire.android
Reena Kushwaha,Great but did not upload fast and not upload more thane 500mb .file,3,com.mediafire.android
Dinesh Chaudhary,Can't sign in via app and can't upload file via website 👏 👏 👏,3,com.mediafire.android
Dynamo mobile,This app uploads problem for uploading time file stop or delete option,3,com.mediafire.android
Rana Rauf,Its a good app but it don't show all the folders,3,com.mediafire.android
B J,I can not open aps. It said unable to connect mediafire!,3,com.mediafire.android
Mr.hakdog Ph,I give three start because when i add file in this app its forced close,3,com.mediafire.android
Gian Carlo Malsi,Devs help. It says could not process request. Now all my files can't be accessed,3,com.mediafire.android
Subeesh King,File.. Uploading...probelam.. Please. Fix,3,com.mediafire.android
Junaid Khan,Very nice app using from last 5 years but the main point is please udate the app,3,com.mediafire.android
Ahmad Farouk,Very powerful website but stuck app,3,com.mediafire.android
AnimeWorld _team,nice but all files atomically save in media fIreland link,3,com.mediafire.android
Ricardo Dela Cruz,This application is helpfull but not all are easy to operate.,3,com.mediafire.android
Denver Ramos,This app can't upload my map. Fix it.,3,com.mediafire.android
Jot Sidhu,Uploading speed is very slow,3,com.mediafire.android
Gydeon,"Please Update, i cannot login via Facebook",3,com.mediafire.android
Raj Gupta,Add Secure lock to this app will more helpful to user for their personal files.,3,com.mediafire.android
Hacka Deen,it dose not show anything that is uploading and dose not upload my Music,3,com.mediafire.android
CroZeus,It is not showing my file's number of downloads and views.,3,com.mediafire.android
Ajay M V,Unable to upload the files :( I'm using moto e2 it (custom os) plz help me......,3,com.mediafire.android
IL Jazzrhen Cenon,I give 2 star Cause I did not open it my Mediafire & I will open the music link in the others😔🥺😌,3,com.mediafire.android
G4M3S AF,developers help me i was fine with the app and suddenly he left my account without me wanting to disconnect,3,com.mediafire.android
Ahmed El-Zeedy,Very basic features,3,com.mediafire.android
Achanti vardhan,Good but can you add logout button for that app is good that's why I gave you 3 star,3,com.mediafire.android
Slifer 00,Files not showing up,3,com.mediafire.android
Sanju Gamage,App fasilities are poor. But your servise is best the best,3,com.mediafire.android
A Google user,I was Trying upload my files but I am unable to do it. Please do something,3,com.mediafire.android
كتب دروس اللغة العربية,Web Upload is not working,3,com.mediafire.android
Baron Nii music,Im not able to upload my second song to the site for download,3,com.mediafire.android
Tweak animations,I gave 3 stars cuz for some reason i cant upload my other files please advice,3,com.mediafire.android
Attan Nehru,The App needs a log out or a passcode feature to ensure privacy/security.,3,com.mediafire.android
Long Đỗ,Need thumbnail for videos apps and web,3,com.mediafire.android
Rajasohan Alam,Upload speed is slow,3,com.mediafire.android
Mudassar Tirmazi,Fast downloading but slow uploading,3,com.mediafire.android
Jenrex Polinag,"I Hate This App I Can't Even Upload A Image It , I Hate It.",3,com.mediafire.android
Miho Snowciel,tidak bisa upload file,3,com.mediafire.android
Bien Grengia,This is why i gave this Three Stars its Because of a bug that is Uploading 0 of 1 items,3,com.mediafire.android
Bhaskar Ray,Fk has the most important thing to do to 3do it 7AM the family and 3rd anniversary is it for the most common day 3of and the next day I am not going anywhere and the only thing that we can get through this morning will get the most 34inches and was just like a show of the year and the way he is the first to mar a child to 6mar,3,com.mediafire.android
Udin ???,When i download this app it stuck at 95℅ Why can i download this app😭😭😭😭,3,com.mediafire.android
S Yadav,Vert good app but upload slowly,3,com.mediafire.android
togialuong luonggiato,Cant upload my file It just 76mb Device: Xiaomi note8 pro Android: 10,3,com.mediafire.android
AUAsafee,It have so problem Upload problem,3,com.mediafire.android
Sumathi Natarajan,Taking more time to upload,3,com.mediafire.android
Pandoax,my problem with mediafire 1.upload my file without permission,3,com.mediafire.android
MC Nash,The app is little lag,3,com.mediafire.android
Jeet aman,i got 10GB WHAT'S PROBLEM THIS,3,com.mediafire.android
Abdullah,please can any tell me how to open the link directly in app,3,com.mediafire.android
Salafi Library سلفی لائبریری,Good but storage is limited,3,com.mediafire.android
Meenakshi Mariappan,I didn't upload any files,3,com.mediafire.android
Tejas Tandan,Previous version theme is better,3,com.mediafire.android
{Len},Three stars Just beacuse i cant make a account fix it pls,3,com.mediafire.android
Hacker Man,I have lost files. Kindly help,3,com.mediafire.android
Kamilia HA. Mohammed,Need to like the site download or make download faster,3,com.mediafire.android
Mohan Kankatala,Its very slow,3,com.mediafire.android
I Gede Rusadi Nata,why i can't upload anyfile?,3,com.mediafire.android
Gamer Shihab,Good but It causes Lags,3,com.mediafire.android
A Google user,why I get only 10 gb?,3,com.mediafire.android
Lender A.Villaf,The app is crashed,3,com.mediafire.android
E S W A R A N,I Am Login Again Again Login Problem Plz Help,3,com.mediafire.android
BlueBlackGaming,This cool but i cannot sign,3,com.mediafire.android
Prince Maurya,Permission denied prblm on download,3,com.mediafire.android
Faltu Fokat ka channel,not too good but ok,3,com.mediafire.android
ΣĐSTΞCH ĐUA,Please update the app,3,com.mediafire.android
Mαruαtα Renthlei,Update your app,3,com.mediafire.android
John andrei Debelen,Can i download by this apk?,3,com.mediafire.android
Pavlam Gnanaraj,Can't reset my password.,3,com.mediafire.android
Mohammad Rashed,Please update this app,3,com.mediafire.android
Dj Jay,Other link error,3,com.mediafire.android
Mosaddika Mou,that was a ball of fun,3,com.mediafire.android
Akhile Kweyama,it's amazing👍,3,com.mediafire.android
Star Hatsune This good,My Oppo A12 is loggy oof how never loggy?,3,com.mediafire.android
Nikki Butterworth,i want 20th cenury fox copy,3,com.mediafire.android
A Google user,Like this app,3,com.mediafire.android
Sajjad Bd Tips,Good not bad,3,com.mediafire.android
Rizmher Faciolan,Because its good,3,com.mediafire.android
Dr ko ko,ေက်းဇူတင္ပါတယ္... သုံးလို္႔အရမ္းေကာင္းပါတယ္..ခမ်ာ..။,3,com.mediafire.android
Hani Birko,Hani biko,3,com.mediafire.android
Ndayishimiye Luberte,Free,3,com.mediafire.android
ALL-SIDE GAMER,⭕️⭕️⭕️,3,com.mediafire.android
Jamshed Khan,Bad,3,com.mediafire.android
Ibrahim ib Ibrahim,Nice,3,com.mediafire.android
Matt H,"Okay so I figured out how to upload at least. You can ONLY upload files from the INTERNAL MEMORY (not external memory card). It doesn't say this anywhere, no message or anything, had to figure it out myself. Then to check the upload progress, tap the top-right menu icon and select ""Uploads"". Lo and behold, there's a progress bar after all! Pretty stupid design given I had to diagnose the problem myself though.",3,com.mediafire.android
Austin,"Seems straight forward, not very feature rich but it's 12 gigs of cloud storage.  Not sure how you ""earn"" anything as i didn't see any settings or options for adding storage space per the app at least.",3,com.mediafire.android
Zameer Shaikh,"First thing you says 50gb but i got 12gb cloud storage. You need to add 
some features, while updating there is no option to pause or to delete. At 
uploading time, if i mistakenly select any file which i do not want to 
upload i can't cancel that file. Guys you should do something for that.",3,com.mediafire.android
Julio Odin Marqez,"Could be an excellent apo, if only the uploads would be better. It shouldn't have been so difficult to make a progress bar for your uploads that actually works. Now you just sit and wait for the upload to change from STARTING UPLOAD (for ages) then suddenly it jumps to 33%...and so on...",3,com.mediafire.android
A Google user,"I want to download a model and it will always say it has a problem I tried over and over again but it won't work, this looked like a very useful  app.",3,com.mediafire.android
Lucya D,Es una buena opción y ahora está presentando fallas por primera vez. No me quiere dejar entrar a mi cuenta 😑😑😑,3,com.mediafire.android
Dorian Glass,"Vanilla, basic storage that is nicely user-friendly.  Features are not that extensive, but, realistically, it's what most folk would require. Happy with the app.",3,com.mediafire.android
JasperYT,"This app is Sucks Website in Better Than I uploading Files it works But No 
Loading Process Can be Fix this Problem please",3,com.mediafire.android
Sivakumar Prakash,"Doesn't have option to upload more files at a time, need to upload one by one..",3,com.mediafire.android
Richie,Uploading Problem ☹️☹️,3,com.mediafire.android
Rafael Tobozo,"No download manager, really? Just uploads.",3,com.mediafire.android
Sagar Verma,Very easy to use but ..We need Device Password Protection for this app..,3,com.mediafire.android
Shubhadip Bachar,I love it but it will be perfect with showing uploading percentage in app,3,com.mediafire.android
AVS Latur,Need some improvement's,3,com.mediafire.android
Red Lloyd,Nice start. But how do I share files from the app?,3,com.mediafire.android
Luxury Đinh,Syn hơi kém,3,com.mediafire.android
apurv rana,Please improve storage 50 gb give him,3,com.mediafire.android
JuuC Myanmar Musician,Like!,3,com.mediafire.android
A Google user,Try now,3,com.mediafire.android
A Google user,i con't use it.,3,com.mediafire.android
Dinesh Arul,Should show the status of uploaded files.,3,com.mediafire.android
Jayanta Kar,Need improvement,3,com.mediafire.android
Dj Santlal KWD,Santlal Tekam,3,com.mediafire.android
A Google user,Mast h,3,com.mediafire.android
Leonardo Jantos,no experience,3,com.mediafire.android
Dan Gar,Ok,3,com.mediafire.android
Ryane Munyasa,Niice,3,com.mediafire.android
guna Dheepan,Ok,3,com.mediafire.android
kaustubh Pathak,Osam,3,com.mediafire.android
Mustafa Azim,Not bad,3,com.mediafire.android
skylegend memes,Good app,3,com.mediafire.android
SATNAM CHUOKA ARTI PATADHI DHAM,Nice wark,3,com.mediafire.android
game boy,Fine app,3,com.mediafire.android
King Bambeta,Good app,3,com.mediafire.android
Faher Frvati,good,3,com.mediafire.android
A Google user,good,3,com.mediafire.android
Ponikarti,Good,3,com.mediafire.android
Mukim Khan,Good,3,com.mediafire.android
I H Mithu,Good,3,com.mediafire.android
Sudarshan Tripathi,Good...,3,com.mediafire.android
Abhishek Srivastava,If i want to upload any 7zip file it can't half-hour it says preparing upload half-hour it says starting uplaod and after 2 hours it says an error occur while uploading this file.. why??and why this app only giving me 12gb it says store over 50gb but i got only 12 gb why?,3,com.mediafire.android
Daksh Monga,It's just okay but not better than Google Drive,3,com.mediafire.android
the sniper shadow sniper,I like it and ones i download it it lite me play but now i need to change the v ti 1.0.0 AND THE APTOIDE HAVE 1.2 BETA so please please please please  let it to 1.2 beta ok thx,3,com.mediafire.android
A Google user,"Good app but crashes sometimes, please add option on which folders to automatically backup (videos & photos)",3,com.mediafire.android
Arnulfo Cerezo,It's working. Only not fast.,3,com.mediafire.android
Kundan Mogre,Can't upload a video on my Samsung galaxy j7 prime with os Noughat.,3,com.mediafire.android
Randy Myers,Can't stream videos 75% of the time,3,com.mediafire.android
level2yeet,I have a problem because when i try to upload a file it says there was a problem uploading the resource. I would really appreciate your support.,3,com.mediafire.android
T Mac FINNESSER,Oh ok,3,com.mediafire.android
F. M.,"So it's great how it uploads so many at one time but there needs more improvement... iv uploaded picture but it mega pixil are bad, the pictures are very blurry.",3,com.mediafire.android
Discreetly Diplomatic,"😟 Loads too slow, uploads far too slow. I had to constantly refresh after I uploaded a (📷📷) file because it didn't upload the 1st or 2nd or 3rd attempt. Also couldn't move files uploaded into a Created Folder(s).",3,com.mediafire.android
Rafat Almehdi,This new Update make the program more bad and bad.. It's not upload anything like before...  Fix it as fast as you can,3,com.mediafire.android
NightMightyWolf Productions,Signing from Facebook Not Working keep on showing [Incorrect e-mail or password]    please fix that bug,3,com.mediafire.android
Les Paton,"Preparing upload goes on forever,  and more often than not , more attempts are needed",3,com.mediafire.android
Tom Tindall,The fact that it does not show the progress of files you are uploading is absurd. How am I supposed to know when an audio file is uploaded without continual checking? Annoying.,3,com.mediafire.android
Sarwar HBK,Upload bar not showing in notification as it used to about a year ago. I dont know if its uploadibg or not unless I open app and refresh to see if new files have been uploaded. Please update or help.,3,com.mediafire.android
Spaghetti,"I have this application on my iPhone and on this Android OnePlus 3T phone. What I don't get is why basic things like the most recent uploads in your pictures is not available. Why are there no different viewing options? That should be a basic feature. Another thing is it becomes very buggy while uploading My Files. I keep getting an error saying ""there was a problem uploading the resource."" The iOS version is much better and has more different settings than this one. Please update this application please!",3,com.mediafire.android
Afaq H,"Much faster than browser based operations. However it has the most basic features. Hope more features would be added, like being able to see the progress of uploading. Edit: upload progress added in new version.",3,com.mediafire.android
A Google user,"Automatic uploading doesn't work, needs sorting of files on demand, and upload progress bar. Not very useful.",3,com.mediafire.android
JuSC,Its cool but theres one problem. It doesn't uploads files in my files it only likes to uploads picturs and etc... 😠,3,com.mediafire.android
munish yadav,This application is really helpful but this application contain some bugs like when we upload any file it's doesn't show notification of it or any details. This application only helpful for  Download count,3,com.mediafire.android
Kakistocracy,It is getting better with each update. I have a MediaFire account since maybe 2011-2012 during MediaFire startup. It was an unpleasant experience. So I very seldom use it maybe 2-3 times a year until lately it became slick and the speed is fast with Photo upload. Recommended for new user but I am not sure how much storage you will be given for free basic account. If the rate is better than its competitor I might buy more storage.,4,com.mediafire.android
Myquel michael Delda,"4star, the uploaded files in folder are being uploaded without folders. It get messy and unorganized. I don't know if this is a bug, but needs to be fixed. But. Overall, still a decent app. Thanks",4,com.mediafire.android
