Reviewer name,Review,Rating,Package name
SEDIMAR SAKILAN SUHAILI,"Make it permanent file uploaded, please remove expiries date.. I hope can do that to us.",1,com.fileupload.filesharing.upfile
DANNY MULEMENA,Failing to upload,1,com.fileupload.filesharing.upfile
Mitiku Tilahun,Good,1,com.fileupload.filesharing.upfile
Mamun Mamun,Badd dog,1,com.fileupload.filesharing.upfile
Sports Highlights,Deserve 3 stars bcoz z not specific in you Tube,3,com.fileupload.filesharing.upfile
Abet Beltran,Lag,3,com.fileupload.filesharing.upfile
The Beshear Family,This app does exactly what it is intended for! I absoulutely love it!! The only thing that i did not like is the fact that each link you make only last for 7 days so you would keep having to make a new link every week pretty much but you can still connect it to the same domain which works out from the outward appearance.. But all in all this app is Awesome! Thank you to the developers for making this app! God Bless,5,com.fileupload.filesharing.upfile
Nilushi Dinushani,I was searching for a file uploading app for instant file sharing which is safe and troustworthy. This brilliant UpFile app helps me to solve my problem easily. Keep it up. All the best. Excellent work.,5,com.fileupload.filesharing.upfile
Joshep Starlin,UpFile is brilliant file upload app. It does exactly what I need and does not ask for any permissions except network access. Great to see a developer caring about not using unnecessary permissions! ❤️👏👏,5,com.fileupload.filesharing.upfile
Zakey Wisdom,"Great app, plz everyone, download this app. If you are searching for a safe internet transfer app, this is it. Exactly what am looking for. You can upload all files of any size and once downloaded, it's deleted from the server. 5 star for you guys.",5,com.fileupload.filesharing.upfile
Nilushi Dinushani,Best upload app that I have seen..❤️😘 Tried many apps but they were nothing comparing to this upFile app. I am using it for few months time and it is very supportive and and user frindly. Highly appriciate your excellent job and wish you all the best. Keep it up. Be the best..😊😊😊👍,5,com.fileupload.filesharing.upfile
Suleyman Shah,Good application but options applications move to sd card app login pin set different email account. Gmail. Yandex mail etc . Uploads and downloads app videos images pdf documents. notes,5,com.fileupload.filesharing.upfile
Iresh Chandrasena,"Simple but useful software , it make easy our file transfering in day to day works.",5,com.fileupload.filesharing.upfile
N&R Creation,The best file upload app I have seen ever. works like a charms. reccomend for everyone.,5,com.fileupload.filesharing.upfile
Demonstator Man,It will be even more useful is there is no time limit(can be turn off or on),5,com.fileupload.filesharing.upfile
David Davenport,I'm actually using it for uploading Any of my dj mixes songs to Pinterest to be put on sale to get paid through stripe account by cash and credit or debit card only,5,com.fileupload.filesharing.upfile
Jonathan swart,Great apk for uploading files😭🔥🔥😁🤧🔥,5,com.fileupload.filesharing.upfile
king DonSkillz,Why should my file have expire date? I want it forever please how can it be done?,5,com.fileupload.filesharing.upfile
Daniel Kemboi,"This app is really good 👍,i can request everyone to download it,,",5,com.fileupload.filesharing.upfile
A Google user,So far o.k. seems pretty good. Still testing,5,com.fileupload.filesharing.upfile
Raymond Burton,Very good thank you,5,com.fileupload.filesharing.upfile
Mohammad Sajid,How much mb file can I send....???,5,com.fileupload.filesharing.upfile
Hersherl Campbell,Worked for me. Thanks.,5,com.fileupload.filesharing.upfile
romesh yatawara,Definitely a must. 👍,5,com.fileupload.filesharing.upfile
Lilo Botayi,Good app,5,com.fileupload.filesharing.upfile
Gigi's glutenfree Lab,Great app,5,com.fileupload.filesharing.upfile
Tuan Rohaiya,♥,5,com.fileupload.filesharing.upfile
Stanley Maasii,Download apps,5,com.fileupload.filesharing.upfile
United America,Rating,5,com.fileupload.filesharing.upfile
BRIAN ZERVOS,Totally understand,5,com.fileupload.filesharing.upfile
Tim Wilson,"I'm very unhappy with Dropbox deleting the album feature from the app. They replied that I can access my pics through the photo button, no kidding. The problem was I had several pics out of thousands added to albums for easy access but it was changed without notice. I'm now more unhappy with what appears to be an insensitive auto generated response. Looks like it's time to find an alternative solution.",1,com.dropbox.android
Davina Wells,"After the Android update this month, Dropbox won't open at all. Uninstalling, clearing cache/storage, resetting allowances, nothing works. The furthest I've been able to get is logging in before it starts crashing again. It also brings up a ""market feedback agent"" error when it crashes. This is the only app I've had problems with since the update.",1,com.dropbox.android
Erin Mawhirter,Very difficult!! I signed up for the free trial to see if this would be a good app to send large picture files to family. It has been the opposite of user friendly. Canceling the subscription is way too difficult for a regular person. It says it is sending you to options for cancelling that then don't exist. Just finding out what type of account one has is difficult. I use a lot of apps. I found this one to be frustrating with support fairly unavailable.,1,com.dropbox.android
Justin Time,"After hearing how great Dropbox was I created an account and tried to upload some videos. I got a message saying ”Can't upload file. Account full."" Searched ""help"" and nothing came up. Of course there was no ”contact us"" page or info in the app either. So with a BRAND NEW account that shows 2GB of space I can't do anything! A one star rating is one too much. MAJOR FAIL🤬☹️🤯",1,com.dropbox.android
Drew,"Not sure what Dropbox is doing but crash crash crash crash crash pixel 6 pro. Don't know why works fine on any other Android phone, but on Google's new pixel crash crash crash reinstall doesn't do anything. It's still just crash. Can't stress it enough then crashing since I got the phone and I've had the phone for several weeks now and other people are complaining about the same thing. Where is the update to fix this? Come on there's no reason for a bug this extreme to last any period of time.",1,com.dropbox.android
Preston Petersen,"Loooove how selecting to save files locally somehow results in files that haven't even slightly changed needing to be re downloaded 20 times a day. Completely defeats the purpose of the app. Absolutely useless. The last time i used it, the only way i could view files that were supposed to be already downloaded was to completely restart my phone. Tons of people reporting fundamental issues with the app... Just make it work!",1,com.dropbox.android
Phil Greiss,"Well well... playing audio thru dropbox became a pita now with the last few updates. Before this show-stoper we could click on an offline wav file in a dropbox folder and have VLC (or your player of choice) start playback *instantly* but now, the cluncky dropbox audio player puts itself beetween you and VLC, making it impossible to quickly audition a series of audio files, adding 3 clicks to a process that used to only take ONE. These constant updates destroy things that do not need re-thinking.",1,com.dropbox.android
BHAKTI BROPHY,"Cannot find ANY of the documents I just ""Uploaded"" from my Android. I also tried ""Sharing"" documents directly from phone to Dropbox app-- which is an option, and only two files transferred. I tried doing them as a group of documents, and transferring one at a time. Still no luck. The only useful thing about this app is receiving documents and videos from other folks. What a shame-- especially since greedy Google decided to take away Google Docs. 'Need trustworthy cloud service.",1,com.dropbox.android
Elyes LOUCIF,"How do I use it if I can't sign in? I can sign in just fine through the browser. However the app doesn't work. With the same password... I can't even reauest an email sign in, or to change the password through the app (by sending an email). Absolutely major flaw.. no cloud storage service could compromise the mobile experience in this way. I have never been a fan of dropbox and this just confirms it. I will be switchint soon.",1,com.dropbox.android
Molly Kitti,"No tech support at all. This used to be a great app, but the most recent security patch broke it. Spent months trying to get help from tech support, but no luck. It's nothing by bots who assume you have a common question and repeat the same wrong answers at you over and over. After 3 months, I still can't get ahold of a human, I still can't access my files, and Dropbox refuses to provide a refund, even though I clearly wasn't getting the service I paid for. I'm switching to their competitors.",1,com.dropbox.android
Doc Ryzoe Sullivan.,"Before this incident, I considered dropbox to be decent. I don't use it much in my day to day life, but I do use it to send work projects to others at my job. But now I come with a warning: DO NOT DOWNLOAD THE DROPBOX APP TO WINDOWS. USE THE WEB BROWSER. Why? Apparently if you ever have to run a system restore Dropbox batch files will error your system restore, and you will HAVE to do a fresh install. I don't use dropbox for system sync, just work files and it has done irreparable damage.",1,com.dropbox.android
Cory Nott,"Great that it syncs photos. It's awful that it won't actually sync unless battery is over 20%, and there is no way to override this. Users have been requesting this for years, but DB rarely changes anything nor have I seen any app improvements. Time to look seriously at Box.",1,com.dropbox.android
Karen Gilbert,I tried to use the backup Dropbox function and it messed up my entire folder system and lost several documents. The chat function was essentially useless and the person was not able to help. I needed my files back immediately because I had a meeting and the email chain was not quick at all. I eventually found out how to fix it after some fiddling but I would NOT recommend using the backup function. It'll mess up your entire filing system.,1,com.dropbox.android
Ernesto Fernandez,"Not recomended. Put pictures in Dropbox and yes the pictures go to another device but when I try to delete them from the first device which is not easy, they are also delete from all devices. Now I have my memory used up in all devices, can't free anything without much time and deleting my good pictures. So Dropbox is asking for money to upgrade. I should have continued with cable connecting devices to make transfers, much simpler and safer.",1,com.dropbox.android
Funkle,"Much buggier on Androids than iPhones. When you are playing a song via Dropbox on Androids, you cannot do anything else on your phone without cancelling the playback. Furthermore, in the last couple of weeks the screen freezes during a playback and you have to unlock your phone in order to quit the playback. As someone who pays for Dropbox, I would really like this app update/fixed, or I may have to move to another cloud storage app.",1,com.dropbox.android
Vendola Lawrence,"There was an update approximately 7 days ago and now I'm getting notifications that Dropbox has a bug. I tried to open the app, and it closes then I get another error message saying that it has a bug. I pay over $100 a yr (in which the price tends to go up every year or so) for this service. I need this to be rectified asap.",1,com.dropbox.android
Sarah Lund,"I'm a paying Plus subscriber and have been using Dropbox for 15+ years. Never had a single issue until today; after updating my Pixel 3A to Android 12, the app crashes when I try to log in. Uninstalling the app, restarting my phone, then reinstalling the app doesn't fix it. This makes Dropbox completely useless on the single device I use/need it for the most. If this isn't fixed quickly I'll be exploring other options for my storage needs.",1,com.dropbox.android
Georgette Patterson,"Wow! I was so close to downloading and trusting my work and personal photos to this app. So many people who have paid for the app can't access their photos, music, videos and all kinds of chaos even opening the app as of recent? Yeah, sorry for all the reviewers-grateful, but feel terribly bad for them as well. I wish you a proper app that works as it says, as well as a good day. Good luck and Thank you.",1,com.dropbox.android
Brandon Miller,"A miserable experience. Joined when the app was free. Used it for long-term photo storage. At some point, they must have decided to shrink the storage amount offered by the trial. My account is now missing the vast majority of the photos in it before, with apparently no way to recover them. Too many other good storage options to even consider this one. What an utter disaster...",1,com.dropbox.android
Kathy Valenzano,"I had the dropbox basic app. It's suited my needs perfectly, all I use it for is to transfer items from my tablet to PC. However, there was a problem, so I uninstalled and reinstalled it. Something went wrong, because it installed the Dropbox Plus. It is absolutely not what I wanted. It caused all kinds of problems on my system. I've worked with somebody and we seem to have cleared up the problem. However I cannot find the free Dropbox app to reload onto my tablet. What am I doing wrong?",1,com.dropbox.android
Julie Watson,"Over the years, GREAT! With the latest update, TERRIBLE. I've used Dropbox for 10 years. I've never had a problem. It would sync with my mobile devices and my laptops and my desktop computers. The update on June 3 screwed up my mobile app & I am unable to access my files. The error message is ""Can't connect to Dropbox. Make sure you're online, or try again later."" WHAT??!!! Um, my phone is connected via cell service & wifi. Customer Service was NOT HELPFUL. I am very frustrated.",1,com.dropbox.android
matthew obrien,"Dropbox worked great for many years (5 star worthy), but over the past few weeks the app keeps telling me ""cannot connect to dropbox, make sure you are online and try again later"". I am online and my device can connect to any other app just not dropbox. All docs, files, photos are hidden from view. I can only find the desired file if I search for the specific file. I cannot save files to specific folders nor can I move files from one folder to another. It is now very difficult to use the app.",1,com.dropbox.android
Justin Gunter,"I'm really disappointed in this company. I've been a Dropbox user since the very beginning. Suddenly, they've introduced an arbitrary three device limit that makes this all but useless unless you pay $120+ a year. I have no problem paying for valuable services, but the fact that you they want longstanding customers to pay over $120 just to sync four devices instead of three is absurd. This is the writing on the wall, time to jump ship because going forward, Dropbox is going to be looking for every arbitrary way it can to extort money out of longtime users. What's next, caps on how many times you can access a file unless you pay for a new $300 a year ""Elite"" tier of service?",1,com.dropbox.android
Ian Blackwell Rogers,"Really didn't help me. I was sent a link by email to add a file to a Dropbox, and couldn't see any way to do it. I added the app, hoping that would help, but got a notification that was too many devices and I'd have to subscribe. Working with Dropbox on my desktop didn't give me any more success, even when I enabled ""Dropbox for Gmail,"" so I have no incentive to pay for this app. Maybe it only works if you're a paying subscriber. I find this very opaque on any device.",1,com.dropbox.android
Matt Voegtli,"I've been using drop box for around 8 years. I've never had an issue with it. Now it's constantly crashing, disconnecting or just not loading. Hopefully they fix it, because this is crazy. Just roll back to the last version. The update on the PC sucks too, but at least you can still access it there through file explorer, which is great.",1,com.dropbox.android
S. Jaye,"There's no way to download folders, only files. If I want to download a folder containing an artist's mp3s, with each album in its own folder, I have to download the individual songs and recreate the folders on my device. Infuriating. Edit: I can't actually download anything. The app says that the files have downloaded, but none of it can be found on my phone. I'm downgrading my rating to one star.",1,com.dropbox.android
Mark Sherman,"I have been a thrilled user of Dropbox for years. But now, only 3 linked devices with free plan. I guess they need to make more money. Goodbye Dropbox! Edit: I should add that the entry level option past free is $10/month for 1TB which is way beyond my needs. I really only used Dropbox for sharing a few files among two desktops, a laptop, a phone, and a tablet. Once in a while I used it to share photos with friends. Offer a cheaper option and maybe I will come back.",1,com.dropbox.android
Christian Avelallemant,"Works fine on iOS. Can download files/folders, move files around within folders and my app will automatically fix the problem within my folder. On Android, this app is a piece of garbage. I'm a paying customer like many others and all I see is the same problem: 'storage full or unavailable' when I try to access my files. I can't even view them! Much less download them. I'm an artist and dropbox has always been my cloud service of choice, but if this bug isn't fixed I'll have to reconsider.",1,com.dropbox.android
Mike Jarecke,"So. Dropbox raises their price above the competition. Yet, for almost 3 years. Yes. 3. They have not fixed a BIG bug with backup. If your roming. Your out of luck with Dropbox. They won't listen or fix the problem. They just don't get it. I have been using them 8 years. I suggest to everyone to change to Google. It's cheaper and does not have a bug issue with camera uploads.",1,com.dropbox.android
A Google user,"Can't figure it out. Can't get downloads off line. Takes forever and repeatedly ""fails"". It is automatically opening this and saving them to Dropbox when that is not where I want it to go. Have spent hours trying to figure out how to change permissions but nothing works. Also very complex to uninstall... multiple places to seek out on computer to get rid of it. Maybe I'm just daft, but it is way beyond me and not user friendly from my view point. Baffeling ☹️",1,com.dropbox.android
Ragan Jones,"Not so excited anymore. I've been using Dropbox for about 6 years to backup pics from my phone. I had earned additional storage space to the point of having 8GBs available to me. Lately, I've been having issues with my files and pictures staying synched between devices. Instead of being able to file my pics and documents away, I write this while I wait for my past week's images to be available to me. I'm off to research other services while I wait for synching to complete.",1,com.dropbox.android
Mr. Guapo,"Signed up for the 30 free trial.  Meh.  Tried to cancel the next day, but there was no button for that in Dropbox.  I had to search for it, and discovered that I had to go to My Subscriptions in Google Play, but COULDN'T.  There's nothing there regarding Dropbox.  Now I'm having a hard time finding the Contact Us link.    Don't sign up for this nuisance.",1,com.dropbox.android
Springer Ranch,"mediocre with untapped potential. It needs to sync files but only allows you online access, defeating it's purpose. It also doesn't register a micro sd card, only allowing for internal device storage. The app only previews files as well, so you have to download the file to preview it, then download again to actually open the file. The desktop app is fantastic, but the mobile version is nearly useless.",1,com.dropbox.android
Chi Seemyown,Y'all trippin... This don't make no sense Been using Dropbox reliably and without fail for YEARS...Now all of a sudden Dropbox won't connect even though I've got data and WiFi internet access. Signing out and in again didn't work and if this uninstall to reinstall doesn't fix the problem that's a wrap for this app. It don't matter to me if it works as it's supposed to on my laptop when I can't access my stuff when on my cell. That completely defeats the purpose. FIX THIS!!!!!,1,com.dropbox.android
Michael Bryson,"Tried to test Dropbox out for sharing information in a project with others. I have to verify my email account to get things started, problem is they never send me a verification email. Not in inbox, not in spam/junk mail. Tried too many times. Googled it and it looks like it is a huge issue that can't be easily resolved. I gave up on it.",1,com.dropbox.android
Eric Rose,"It is amazing to me that Dropbox hasn't figured out that their thumbnails are so small that you can't tell what you are looking at. Managing photos in Dropbox is impossible, slow and tedious. We had to move 120,000 images to Google photos so we could actually find images without having to open them just to see what we couldn't see in the thumbnail.",1,com.dropbox.android
George Abraham,I am a paid subscriber but have constant issues with Dropbox. The interface is just not intuitive. You can't restore files from within the app--you need to open your web browser. Simple prompts to overwrite files are non existent: you need to go into a file manager and delete the file first. Support is so horrible to deal with you end up just living with it's many flaws. Sure wish someone at Dropbox actually took a look at their user experience. You figured it get better as a subscriber but it's not.,1,com.dropbox.android
timtom,Horrendous application routinely fails at backing up my cell phone pics. That's the only thing I ask Dropbox to do. It does work for a while then it randomly stops backing up for no apparent reason. And you have no idea that it has decided to stop..... you think your photos are being protected but they are not. NEXT!!!,1,com.dropbox.android
Alto Octave,"I changed phones and phone services recently. Dropbox doesn't work as it did in my old phone, with the emphasis on ""doesn't work"". Where are my files? They were always accessible on my old phone. I haven't a clue how to access them. I can use the browser to access them, I guess, but then why bother to have the app? Really annoying.☹️",1,com.dropbox.android
Brianna Novack,"Signed up for the 30 day free trial, wanted to cancel after a week. It was super hard to figure out how to cancel but finally found it after 30 min of searching around and thought it was done. Nope, they are still charging me 9.99 a month. I cancelled it two more times and now I just got another email saying they charged me again. I'm really annoyed with this app. Don't download!",1,com.dropbox.android
J K,"Dropbox FORCES you to use this app version on your mobile device, when you'd prefer to the actual site, then severely limits what you can do with the files via the app. ""Want to hear an MP3 that someone shared with you? Sorry you cant do that on the app."" Why? What's the point? Thanks for choosing to make life more difficult for your users, Dropbox.",1,com.dropbox.android
L,"I love this concept and Dropbox in general. the problem is: this app FREAKIN SUCKS! Dropbox works great from a laptop or desktop computer. But from a cellphone it blows! I have the settings arranged so that it's SUPPOSED to upload pics (or docs) on demand, whether I'm connected to Wi-Fi or not. And although I do use Battery-Saver on my android (S9 Plus), I have an exception for this app, to be exempt. So it should upload stuff instantly. But half the time it does not. waits for days sometimes! 😡",1,com.dropbox.android
Michael Roe,How far the mighty have fallen! What was once a dependable go-to for promptly backing up the photos and videos from my phone has now become a complete joke. The sleeping giant no longer auto-uploads no matter what setting I use. Now I have to go in manually & hand choose all the photos and videos I want backed up and then set my screen to stay on for 10 minutes or it will stop uploading. It's bad enough to make me want to go back to Hightail. What a waste!,1,com.dropbox.android
Brett Buonamici,"was a useful app until they took what had been a free feature for like 10 years and turned it into something you need to pay for. they only allow you to connect to 3 devices, more than that you have to pay. but with two laptops, tablets and phones it was great because you have access to all your files from every device but now you dont. I just moved all files to onedrive, bye bye dropbox. charge for something google, box, onedrive, etc all do for free? stupid",1,com.dropbox.android
Leland Goodman,"I've been using Dropbox for many years and it's true, the user experience has been going steeply downhill for a while now. I already pay for the service but the app constantly continues to ask for me to upgrade. Why is saving photos so convoluted? PLEASE just make it so I can open up a photo, long-press it and have that pop up a ""save to device"" option.",1,com.dropbox.android
WM McCall,"Dropbox changed agreement to three devices only, but said you can keep it installed on existing devices.  I replaced my phone with a new one and tried to install Dropbox on it.  You might think, so what, just uninstall it from the old phone then install it on the new.  But no, you have to uninstall it from all other devices to get down to the three device limit.  Works for me, until I find another app, even if I have to pay for the new one.",1,com.dropbox.android
